ticker,name,sector,industry,exchange
IHS,IHS Holding Limited Ordinary Shares,,,NYSE
IHT,InnSuites Hospitality Trust Shares of Beneficial Interest,,,AMEX
IIF,"Morgan Stanley India Investment Fund, Inc. Common Stock",,,NYSE
III,Information Services Group Inc. Common Stock,,,NASDAQ
IIIN,"Insteel Industries, Inc. Common Stock",,,NYSE
IIIV,"i3 Verticals, Inc. Class A Common Stock",,,NASDAQ
IIM,Invesco Value Municipal Income Trust Common Stock,,,NYSE
IIPR,"Innovative Industrial Properties, Inc. Common Stock",,,NYSE
IKT,"Inhibikase Therapeutics, Inc. Common Stock",,,NASDAQ
ILAG,Intelligent Living Application Group Inc. Ordinary Shares,,,NASDAQ
ILLU,Illumination Acquisition Corp I Class A Ordinary Shares,,,NASDAQ
ILLUU,Illumination Acquisition Corp I Units,,,NASDAQ
ILMN,"Illumina, Inc. Common Stock",,,NASDAQ
ILPT,Industrial Logistics Properties Trust Common Shares of Beneficial Interest,,,NASDAQ
IMA,"ImageneBio, Inc. Common Stock",,,NASDAQ
IMAX,Imax Corporation Common Stock,,,NYSE
IMCR,Immunocore Holdings plc American Depositary Shares,,,NASDAQ
IMDX,Insight Molecular Diagnostics Inc. Common Stock,,,NASDAQ
IMKTA,"Ingles Markets, Incorporated Class A Common Stock",,,NASDAQ
IMMR,Immersion Corporation Common Stock,,,NASDAQ
IMMX,"Immix Biopharma, Inc. Common Stock",,,NASDAQ
IMNM,"Immunome, Inc. Common Stock",,,NASDAQ
IMNN,"Imunon, Inc. Common Stock",,,NASDAQ
IMO,Imperial Oil Limited Common Stock,,,AMEX
IMOS,ChipMOS TECHNOLOGIES INC. American Depositary Shares,,,NASDAQ
IMPP,Imperial Petroleum Inc. Common Shares,,,NASDAQ
IMPPP,Imperial Petroleum Inc. 8.75% Series A Cumulative Redeemable Perpetual Preferred Shares,,,NASDAQ
IMRN,Immuron Limited American Depositary Shares,,,NASDAQ
IMRX,Immuneering Corporation Class A Common Stock,,,NASDAQ
IMSR,Terrestrial Energy Inc. Common Stock  ,,,NASDAQ
IMSRW,Terrestrial Energy Inc. Warrant,,,NASDAQ
IMTX,Immatics N.V. Ordinary Shares,,,NASDAQ
IMUX,"Immunic, Inc. Common Stock",,,NASDAQ
IMVT,"Immunovant, Inc. Common Stock",,,NASDAQ
IMXI,"International Money Express, Inc. Common Stock",,,NASDAQ
INAB,"IN8bio, Inc. Common Stock",,,NASDAQ
INAC,Indigo Acquisition Corp. Ordinary Shares,,,NASDAQ
INACU,Indigo Acquisition Corp. Unit,,,NASDAQ
INBK,First Internet Bancorp Common Stock,,,NASDAQ
INBKZ,First Internet Bancorp 6.0% Fixed-to-Floating Rate Subordinated Notes Due 2029,,,NASDAQ
INBS,Intelligent Bio Solutions Inc. Common Stock,,,NASDAQ
INBX,"Inhibrx Biosciences, Inc. Common Stock",,,NASDAQ
INCY,Incyte Corp. Common Stock,,,NASDAQ
INDB,Independent Bank Corp. Common Stock,,,NASDAQ
INDI,"indie Semiconductor, Inc. Class A Common Stock",,,NASDAQ
INDO,Indonesia Energy Corporation Limited Ordinary Shares,,,AMEX
INDP,"Indaptus Therapeutics, Inc. Common Stock",,,NASDAQ
INDV,"Indivior Pharmaceuticals, Inc. Common Stock",,,NASDAQ
INFQ,"Infleqtion, Inc. Common Stock",,,NYSE
INFU,"InfuSystems Holdings, Inc. Common Stock",,,AMEX
INFY,Infosys Limited American Depositary Shares,,,NYSE
ING,"ING Group, N.V. Common Stock",,,NYSE
INGM,Ingram Micro Holding Corporation Common Stock,,,NYSE
INGN,"Inogen, Inc Common Stock",,,NASDAQ
INGR,Ingredion Incorporated Common Stock,,,NYSE
INIO,INNIO N.V. Ordinary Shares,,,NASDAQ
INKT,"MiNK Therapeutics, Inc. Common Stock",,,NASDAQ
INLF,INLIF LIMITED Class A Ordinary Shares,,,NASDAQ
INLX,"Intellinetics, Inc. Common Stock",,,AMEX
INM,InMed Pharmaceuticals Inc. Common Shares,,,NASDAQ
INMB,INmune Bio Inc. Common stock,,,NASDAQ
INMD,InMode Ltd. Ordinary Shares,,,NASDAQ
INN,"Summit Hotel Properties, Inc. Common Stock",,,NYSE
INNV,InnovAge Holding Corp. Common Stock,,,NASDAQ
INO,"Inovio Pharmaceuticals, Inc. Common Stock",,,NASDAQ
INOD,Innodata Inc. Common Stock,,,NASDAQ
INR,"Infinity Natural Resources, Inc. Class A Common Stock",,,NYSE
INSE,"Inspired Entertainment, Inc. Common Stock",,,NASDAQ
INSG,Inseego Corp. Common Stock,,,NASDAQ
INSM,Insmed Incorporated Common Stock,,,NASDAQ
INSP,"Inspire Medical Systems, Inc. Common Stock",,,NYSE
INSW,"International Seaways, Inc. Common Stock ",,,NYSE
INTA,"Intapp, Inc. Common Stock",,,NASDAQ
INTC,Intel Corporation Common Stock,,,NASDAQ
INTG,Intergroup Corporation (The) Common Stock,,,NASDAQ
INTJ,Intelligent Group Limited Class A Ordinary Shares ,,,NASDAQ
INTR,Inter & Co. Inc. Class A Common Shares,,,NASDAQ
INTS,"Intensity Therapeutics, Inc. Common stock",,,NASDAQ
INTT,inTest Corporation Common Stock,,,AMEX
INTU,Intuit Inc. Common Stock,,,NASDAQ
INUV,"Inuvo, Inc.",,,AMEX
INV,"Innventure, Inc. Common Stock",,,NASDAQ
INVA,"Innoviva, Inc. Common Stock",,,NASDAQ
INVE,"Identiv, Inc. Common Stock",,,NASDAQ
INVH,Invitation Homes Inc. Common Stock,,,NYSE
INVX,"Innovex International, Inc. Common Stock",,,NYSE
IONQ,"IonQ, Inc. Common Stock",,,NYSE
IONR,ioneer Ltd American Depositary Shares,,,NASDAQ
IONS,"Ionis Pharmaceuticals, Inc. Common Stock",,,NASDAQ
IOR,"Income Opportunity Realty Investors, Inc. Common Stock",,,AMEX
IOSP,Innospec Inc. Common Stock,,,NASDAQ
IOT,Samsara Inc. Class A Common Stock,,,NYSE
IOTR,iOThree Limited Ordinary Shares,,,NASDAQ
IOVA,"Iovance Biotherapeutics, Inc. Common Stock",,,NASDAQ
IP,International Paper Company Common Stock,,,NYSE
IPAR,"Interparfums, Inc. Common Stock",,,NASDAQ
IPCX,Inflection Point Acquisition Corp. III Class A Ordinary Shares,,,NASDAQ
IPCXU,Inflection Point Acquisition Corp. III Units,,,NASDAQ
IPEX,Inflection Point Acquisition Corp. V Class A Ordinary Shares,,,NASDAQ
IPFX,Inflection Point Acquisition Corp. VI Class A Ordinary Shares,,,NASDAQ
IPFXU,Inflection Point Acquisition Corp. VI Units,,,NASDAQ
IPFXW,Inflection Point Acquisition Corp. VI Warrant,,,NASDAQ
IPGP,IPG Photonics Corporation Common Stock,,,NASDAQ
IPHA,Innate Pharma S.A. ADS,,,NASDAQ
IPI,"Intrepid Potash, Inc Common Stock",,,NYSE
IPM,Intelligent Protection Management Corp. Common Stock ,,,NASDAQ
IPSC,"Century Therapeutics, Inc. Common Stock",,,NASDAQ
IPST,"IP Strategy Holdings, Inc. Common Stock",,,NASDAQ
IPVVU,"InterPrivate Investment Partners V, Inc. Units",,,NASDAQ
IPW,iPower Inc. Common Stock,,,NASDAQ
IPWR,Ideal Power Inc. Common Stock,,,NASDAQ
IPX,IperionX Limited American Depositary Share,,,NASDAQ
IQ,"iQIYI, Inc. American Depositary Shares",,,NASDAQ
IQI,Invesco Quality Municipal Income Trust Common Stock,,,NYSE
IQST,iQSTEL Inc. Common Stock,,,NASDAQ
IQV,"IQVIA Holdings, Inc. Common Stock",,,NYSE
IR,Ingersoll Rand Inc. Common Stock,,,NYSE
IRAB,Iris Acquisition Corp II Class A Ordinary Shares,,,NYSE
IRD,"Opus Genetics, Inc. Common Stock",,,NASDAQ
IRDM,Iridium Communications Inc Common Stock,,,NASDAQ
IREN,IREN Limited Ordinary Shares,,,NASDAQ
IRHO,Iron Horse Acquisitions II Corp. Common Stock,,,NASDAQ
IRIX,IRIDEX Corporation Common Stock,,,NASDAQ
IRM,Iron Mountain Incorporated (Delaware)Common Stock REIT,,,NYSE
IRMD,iRadimed Corporation Common Stock,,,NASDAQ
IRON,"Disc Medicine, Inc. Common Stock",,,NASDAQ
IRS,IRSA Inversiones Y Representaciones S.A. Global Depositary Shares (Each representing ten shares of Common Stock),,,NYSE
IRT,"Independence Realty Trust, Inc. Common Stock",,,NYSE
IRTC,"iRhythm Holdings, Inc. Common Stock",,,NASDAQ
IRWD,"Ironwood Pharmaceuticals, Inc. Class A Common Stock",,,NASDAQ
ISBA,Isabella Bank Corporation Common stock,,,NASDAQ
ISD,"PGIM High Yield Bond Fund, Inc.",,,NYSE
ISNRU,Snow Rothschild Acquisition Corp. Units,,,NASDAQ
ISOU,IsoEnergy Ltd. Common Shares,,,AMEX
ISPC,iSpecimen Inc. Common Stock,,,NASDAQ
ISPR,Ispire Technology Inc. Common Stock,,,NASDAQ
ISRG,"Intuitive Surgical, Inc. Common Stock",,,NASDAQ
ISSC,"Innovative Solutions and Support, Inc. Common Stock",,,NASDAQ
ISTR,Investar Holding Corporation Common Stock,,,NASDAQ
IT,"Gartner, Inc. Common Stock",,,NYSE
ITGR,Integer Holdings Corporation Common Stock,,,NYSE
ITHA,ITHAX Acquisition Corp III Class A Ordinary Shares,,,NASDAQ
ITHAU,ITHAX Acquisition Corp III Units,,,NASDAQ
ITIC,Investors Title Company Common Stock,,,NASDAQ
ITRG,Integra Resources Corp. Common Shares,,,AMEX
ITRI,"Itron, Inc. Common Stock",,,NASDAQ
ITRN,Ituran Location and Control Ltd. Ordinary Shares,,,NASDAQ
ITT,ITT Inc. Common Stock ,,,NYSE
ITUB,Itau Unibanco Banco Holding SA American Depositary Shares (Each repstg 500 Preferred shares),,,NYSE
ITW,Illinois Tool Works Inc. Common Stock,,,NYSE
IVA,Inventiva S.A. American Depository Shares,,,NASDAQ
IVF,"INVO Fertility, Inc. Common Stock",,,NASDAQ
IVR,INVESCO MORTGAGE CAPITAL INC Common Stock,,,NYSE
IVT,InvenTrust Properties Corp. Common Stock,,,NYSE
IVZ,Invesco Ltd Common Stock,,,NYSE
IX,ORIX Corporation American Depositary Shares,,,NYSE
IXHL,Incannex Healthcare Inc. Common Stock,,,NASDAQ
IZEA,"IZEA Worldwide, Inc. Common Stock",,,NASDAQ
J,Jacobs Solutions Inc. Common Stock,,,NYSE
JABRU,JAB Acquisition Corp I Unit,,,NASDAQ
JACK,Jack In The Box Inc. Common Stock,,,NASDAQ
JACS,Jackson Acquisition Company II Class A Ordinary Shares,,,NYSE
JAGU,Jaguar Uranium Corp. Class A Common Shares,,,AMEX
JAGX,"Jaguar Health, Inc. Common Stock",,,NASDAQ
JAKK,"JAKKS Pacific, Inc. Common Stock",,,NASDAQ
JAN,"Janus Living, Inc. Class A-1 Common Stock",,,NYSE
JANX,"Janux Therapeutics, Inc. Common Stock",,,NASDAQ
JATT,JATT II Acquisition Corp Ordinary Shares,,,NASDAQ
JAZZ,Jazz Pharmaceuticals plc Common Stock (Ireland),,,NASDAQ
JBGS,JBG SMITH Properties Common Shares ,,,NYSE
JBHT,"J.B. Hunt Transport Services, Inc. Common Stock",,,NASDAQ
JBI,"Janus International Group, Inc. Common Stock",,,NYSE
JBIO,"Jade Biosciences, Inc. Common Stock",,,NASDAQ
JBK,Lehman ABS 3.50 3.50% Adjustable Corp Backed Tr Certs GS Cap I,,,NYSE
JBL,Jabil Inc. Common Stock,,,NYSE
JBLU,JetBlue Airways Corporation Common Stock,,,NASDAQ
JBS,JBS N.V. Class A Common Shares,,,NYSE
JBSS,"John B. Sanfilippo & Son, Inc. Common Stock",,,NASDAQ
JBTM,JBT Marel Corporation Common Stock,,,NYSE
JCAP,"Jefferson Capital, Inc. Common Stock",,,NASDAQ
JCE,Nuveen Core Equity Alpha Fund Common Shares of Beneficial Interest,,,NYSE
JCI,Johnson Controls International plc Ordinary Share,,,NYSE
JCSE,JE Cleantech Holdings Limited Ordinary Shares,,,NASDAQ
JCTC,Jewett-Cameron Trading Company Common Shares,,,NASDAQ
JD,"JD.com, Inc. American Depositary Shares",,,NASDAQ
JEF,Jefferies Financial Group Inc. Common Stock,,,NYSE
JELD,"JELD-WEN Holding, Inc. Common Stock",,,NYSE
JEM,707 Cayman Holdings Limited Ordinary Shares,,,NASDAQ
JENA,Jena Acquisition Corporation II Class A Ordinary Shares,,,NYSE
JF,J and Friends Holdings Limited American Depositary Shares,,,NASDAQ
JFB,JFB Construction Holdings Class A Common Stock,,,NASDAQ
JFIN,Jiayin Group Inc. American Depositary Shares,,,NASDAQ
JFR,Nuveen Floating Rate Income Fund Common Stock,,,NYSE
JFU,9F Inc. American Depositary Shares,,,NASDAQ
JG,Aurora Mobile Limited American Depositary Shares,,,NASDAQ
JGH,Nuveen Global High Income Fund Common Shares of Beneficial Interest,,,NYSE
JHG,Janus Henderson Group plc Ordinary Shares,,,NYSE
JHI,John Hancock Investors Trust Common Stock,,,NYSE
JHS,John Hancock Income Securities Trust Common Stock,,,NYSE
JHX,James Hardie Industries plc. Ordinary Shares,,,NYSE
JILL,"J. Jill, Inc. Common Stock",,,NYSE
JJSF,J & J Snack Foods Corp. Common Stock,,,NASDAQ
JKHY,"Jack Henry & Associates, Inc. Common Stock",,,NASDAQ
JKS,JinkoSolar Holding Company Limited American Depositary Shares (each representing 4 Common Shares),,,NYSE
JL,J-Long Group Limited Class A Ordinary Shares,,,NASDAQ
JLHL,Julong Holding Limited Class A Ordinary Shares,,,NASDAQ
JLL,Jones Lang LaSalle Incorporated Common Stock,,,NYSE
JLS,Nuveen Mortgage and Income Fund,,,NYSE
JMIA,"Jumia Technologies AG American Depositary Shares, each representing two Ordinary Shares",,,NYSE
JMM,Nuveen Multi-Market Income Fund (MA),,,NYSE
JMSB,"John Marshall Bancorp, Inc. Common Stock",,,NASDAQ
JNJ,Johnson & Johnson Common Stock,,,NYSE
JOBY,"Joby Aviation, Inc. Common Stock",,,NYSE
JOE,St. Joe Company (The) Common Stock,,,NYSE
JOF,Japan Smaller Capitalization Fund Inc Common Stock,,,NYSE
JOUT,Johnson Outdoors Inc. Class A Common Stock,,,NASDAQ
JOYY,JOYY Inc. American Depositary Shares,,,NASDAQ
JPC,Nuveen Preferred & Income Opportunities Fund,,,NYSE
JPM,JP Morgan Chase & Co. Common Stock,,,NYSE
JQC,Nuveen Credit Strategies Income Fund Shares of Beneficial Interest,,,NYSE
JRI,Nuveen Real Asset Income and Growth Fund Common Shares of Beneficial Interest,,,NYSE
JRS,Nuveen Real Estate Income Fund Common Shares of Beneficial Interest,,,NYSE
JRSH,"Jerash Holdings (US), Inc. Common Stock",,,NASDAQ
JRVR,"James River Group Holdings, Inc. Common Stock",,,NASDAQ
JSM,"Navient Corporation 6% Senior Notes due December 15, 2043",,,NASDAQ
JTAI,Jet.AI Inc. Common Stock,,,NASDAQ
JVA,"Coffee Holding Co., Inc. Common Stock",,,NASDAQ
JWEL,Jowell Global Ltd. Ordinary Shares,,,NASDAQ
JXG,JX Luxventure Group Inc. Common Stock,,,NASDAQ
JXN,Jackson Financial Inc. Class A Common Stock ,,,NYSE
JYNT,The Joint Corp. Common Stock,,,NASDAQ
JZXN,"Jiuzi Holdings, Inc. Ordinary Shares",,,NASDAQ
KAI,Kadant Inc Common Stock,,,NYSE
KALA,"KALA BIO, Inc. Common Stock",,,NASDAQ
KALU,Kaiser Aluminum Corporation Common Stock,,,NASDAQ
KARO,Karooooo Ltd. Ordinary Shares,,,NASDAQ
KB,KB Financial Group Inc,,,NYSE
KBDC,"Kayne Anderson BDC, Inc. Common Stock",,,NYSE
KBH,KB Home Common Stock,,,NYSE
KBON,Karbon Capital Partners Corp. Class A Ordinary Shares,,,NASDAQ
KBONU,Karbon Capital Partners Corp. Units,,,NASDAQ
KBR,"KBR, Inc. Common Stock",,,NYSE
KBSX,FST Corp. Ordinary Shares,,,NASDAQ
KC,Kingsoft Cloud Holdings Limited American Depositary Shares,,,NASDAQ
KCHV,Kochav Defense Acquisition Corp. Class A Ordinary Shares,,,NASDAQ
KCHVU,Kochav Defense Acquisition Corp. Units,,,NASDAQ
KD,"Kyndryl Holdings, Inc. Common Stock",,,NYSE
KDK,"Kodiak AI, Inc. Common Stock ",,,NASDAQ
KDP,Keurig Dr Pepper Inc. Common Stock,,,NASDAQ
KE,"Kimball Electronics, Inc. Common Stock",,,NASDAQ
KEEL,Keel Infrastructure Corp. Common Stock,,,NASDAQ
KELYA,"Kelly Services, Inc. Class A Common Stock",,,NASDAQ
KELYB,"Kelly Services, Inc. Class B Common Stock",,,NASDAQ
KEN,Kenon Holdings Ltd. Ordinary Shares,,,NYSE
KEP,Korea Electric Power Corporation Common Stock,,,NYSE
KEQU,Kewaunee Scientific Corporation Common Stock,,,NASDAQ
KEX,Kirby Corporation Common Stock,,,NYSE
KEY,KeyCorp Common Stock,,,NYSE
KEYS,Keysight Technologies Inc. Common Stock,,,NYSE
KEYYU,Keystone Acquisition Corp. Unit,,,NASDAQ
KF,"Korea Fund, Inc. (The) New Common Stock",,,NYSE
KFFB,Kentucky First Federal Bancorp Common Stock,,,NASDAQ
KFII,K&F Growth Acquisition Corp. II Class A Ordinary shares,,,NASDAQ
KFIIU,K&F Growth Acquisition Corp. II Unit,,,NASDAQ
KFRC,"Kforce, Inc. Common Stock",,,NYSE
KFY,Korn Ferry Common Stock,,,NYSE
KG,"Kestrel Group, Ltd.",,,NASDAQ
KGC,Kinross Gold Corporation Common Stock,,,NYSE
KGEI,Kolibri Global Energy Inc. Common stock,,,NASDAQ
KGS,"Kodiak Gas Services, Inc. Common Stock",,,NYSE
KHC,The Kraft Heinz Company Common Stock,,,NASDAQ
KIDS,OrthoPediatrics Corp. Common Stock,,,NASDAQ
KIDZ,KIDZ AI Inc. Class B Common Stock,,,NASDAQ
KIM,Kimco Realty Corporation (HC) Common Stock,,,NYSE
KINS,"Kingstone Companies, Inc. Common Stock",,,NASDAQ
KIO,KKR Income Opportunities Fund Common Shares,,,NYSE
KITT,"Nauticus Robotics, Inc. Common stock",,,NASDAQ
KKR,KKR & Co. Inc. Common Stock,,,NYSE
KKRS,KKR Group Finance Co. IX LLC 4.625% Subordinated Notes due 2061,,,NYSE
KKRT,KKR & Co. Inc. 6.875% Subordinated Notes due 2065,,,NYSE
KLAC,KLA Corporation Common Stock,,,NASDAQ
KLAR,Klarna Group plc Ordinary Shares,,,NYSE
KLC,"KinderCare Learning Companies, Inc. Common Stock",,,NYSE
KLIC,"Kulicke and Soffa Industries, Inc. Common Stock",,,NASDAQ
KLRA,"Kailera Therapeutics, Inc. Common Stock",,,NASDAQ
KLRS,"Kalaris Therapeutics, Inc. Common Stock",,,NASDAQ
KLTR,"Kaltura, Inc. Common Stock",,,NASDAQ
KLXE,"KLX Energy Services Holdings, Inc. Common Stock",,,NASDAQ
KMB,Kimberly-Clark Corporation Common Stock,,,NASDAQ
KMDA,Kamada Ltd. Ordinary Shares,,,NASDAQ
KMI,"Kinder Morgan, Inc. Common Stock",,,NYSE
KMPB,Kemper Corporation 5.875% Fixed-Rate Reset Junior Subordinated Debentures due 2062,,,NYSE
KMPR,Kemper Corporation,,,NYSE
KMRK,K-Tech Solutions Company Limited Class A Ordinary Shares,,,NASDAQ
KMT,Kennametal Inc. Common Stock,,,NYSE
KMTS,"Kestra Medical Technologies, Ltd. Common Stock",,,NASDAQ
KMX,CarMax Inc,,,NYSE
KN,Knowles Corporation Common Stock,,,NYSE
KNF,Knife Riv Holding Co. Common Stock,,,NYSE
KNOP,KNOT Offshore Partners LP Common Units representing Limited Partner Interests,,,NYSE
KNSA,"Kiniksa Pharmaceuticals International, plc Class A Ordinary Shares",,,NASDAQ
KNSL,"Kinsale Capital Group, Inc. Common Stock",,,NYSE
KNTK,Kinetik Holdings Inc. Class A Common Stock,,,NYSE
KNX,Knight-Swift Transportation Holdings Inc.,,,NYSE
KO,Coca-Cola Company (The) Common Stock,,,NYSE
KOD,Kodiak Sciences Inc Common Stock,,,NASDAQ
KODK,Eastman Kodak Company Common New,,,NYSE
KOF,"Coca Cola Femsa S.A.B. de C.V.  American Depositary Shares, each representing 10 Units (each Unit consists of 3 Series B Shares and 5 Series L Shares)",,,NYSE
KOP,Koppers Holdings Inc. Common Stock,,,NYSE
KOPN,Kopin Corporation Common Stock,,,NASDAQ
KORE,"KORE Group Holdings, Inc. Common Stock",,,NYSE
KOS,Kosmos Energy Ltd. Common Shares (DE),,,NYSE
KOSS,Koss Corporation Common Stock,,,NASDAQ
KOYN,CSLM Digital Asset Acquisition Corp III Class A Ordinary Shares,,,NASDAQ
KPET,KPET Ultra Paceline Corporation Class A Ordinary Shares,,,NYSE
KPLT,"Katapult Holdings, Inc. Common Stock",,,NASDAQ
KPRX,"Kiora Pharmaceuticals, Inc.  Common Stock",,,NASDAQ
KPTI,Karyopharm Therapeutics Inc. Common Stock,,,NASDAQ
KR,Kroger Company (The) Common Stock,,,NYSE
KRAQ,KRAKacquisition Corp Class A Ordinary Shares,,,NASDAQ
KRAQU,KRAKacquisition Corp Unit,,,NASDAQ
KRC,Kilroy Realty Corporation Common Stock,,,NYSE
KREF,KKR Real Estate Finance Trust Inc. Common Stock,,,NYSE
KRG,Kite Realty Group Trust Common Stock,,,NYSE
KRKR,36Kr Holdings Inc. American Depositary Shares,,,NASDAQ
KRMD,"KORU Medical Systems, Inc. Common Stock (DE)",,,NASDAQ
KRMN,Karman Holdings Inc. Common Stock,,,NYSE
KRNT,Kornit Digital Ltd. Ordinary Shares,,,NASDAQ
KRNY,Kearny Financial Corp Common Stock,,,NASDAQ
KRO,Kronos Worldwide Inc Common Stock,,,NYSE
KROS,"Keros Therapeutics, Inc. Common Stock",,,NASDAQ
KRP,Kimbell Royalty Partners Common Units Representing Limited Partner Interests,,,NYSE
KRRO,"Korro Bio, Inc. Common Stock",,,NASDAQ
KRSP,Rice Acquisition Corporation 3 Class A Ordinary Shares,,,NYSE
KRT,Karat Packaging Inc. Common Stock,,,NASDAQ
KRUS,"Kura Sushi USA, Inc. Class A Common Stock",,,NASDAQ
KRYS,"Krystal Biotech, Inc. Common Stock",,,NASDAQ
KSCP,"Knightscope, Inc. Class A Common Stock",,,NASDAQ
KSPI,Joint Stock Company Kaspi.kz American Depository Shares,,,NASDAQ
KSS,Kohl's Corporation Common Stock,,,NYSE
KT,KT Corporation Common Stock,,,NYSE
KTB,"Kontoor Brands, Inc. Common Stock ",,,NYSE
KTCC,Key Tronic Corporation Common Stock,,,NASDAQ
KTF,DWS Municipal Income Trust,,,NYSE
KTH,Structures Products Cp 8% CorTS Issued by Peco Energy Cap Tr II Preferred Stock,,,NYSE
KTN,Structured Products Corp 8.205% CorTS 8.205% Corporate Backed Trust Securities (CorTS),,,NYSE
KTOS,"Kratos Defense & Security Solutions, Inc. Common Stock",,,NASDAQ
KTWO,K2 Capital Acquisition Corporation Class A Ordinary Share,,,NASDAQ
KTWOU,K2 Capital Acquisition Corporation Units,,,NASDAQ
KULR,"KULR Technology Group, Inc. Common Stock",,,AMEX
KURA,"Kura Oncology, Inc. Common Stock",,,NASDAQ
KUST,"Kustom Entertainment, Inc. Common Stock",,,NASDAQ
KVAC,Keen Vision Acquisition Corporation Ordinary Shares,,,NASDAQ
KVACU,Keen Vision Acquisition Corporation Units,,,NASDAQ
KVHI,"KVH Industries, Inc. Common Stock",,,NASDAQ
KVUE,Kenvue Inc. Common Stock,,,NYSE
KVYO,"Klaviyo, Inc. Series A Common Stock",,,NYSE
KW,Kennedy-Wilson Holdings Inc. Common Stock,,,NYSE
KWR,Quaker Houghton Common Stock,,,NYSE
KWY,Kingsway Corporation Common Stock,,,NYSE
KXIN,Kaixin Holdings Ordinary Shares,,,NASDAQ
KYIV,Kyivstar Group Ltd. Common Shares,,,NASDAQ
KYIVW,Kyivstar Group Ltd. Warrant,,,NASDAQ
KYMR,"Kymera Therapeutics, Inc. Common Stock",,,NASDAQ
KYN,"Kayne Anderson Energy Infrastructure Fund, Inc.",,,NYSE
KYNB,"Kyntra Bio, Inc. Common Stock",,,NASDAQ
KYTX,"Kyverna Therapeutics, Inc. Common Stock",,,NASDAQ
KZIA,Kazia Therapeutics Limited American Depositary Shares,,,NASDAQ
L,Loews Corporation Common Stock,,,NYSE
LAC,Lithium Americas Corp. Common Shares,,,NYSE
LAD,"Lithia Motors, Inc. Common Stock",,,NYSE
LADR,Ladder Capital Corp Class A Common Stock,,,NYSE
LAES,SEALSQ Corp Ordinary Shares,,,NASDAQ
LAFA,LaFayette Acquisition Corp. Ordinary Share,,,NASDAQ
LAFAU,LaFayette Acquisition Corp. Unit,,,NASDAQ
LAKE,"Lakeland Industries, Inc. Common Stock",,,NASDAQ
LAMR,Lamar Advertising Company Class A Common Stock,,,NASDAQ
LAND,Gladstone Land Corporation Common Stock,,,NASDAQ
LANDO,Gladstone Land Corporation 6.00% Series B Cumulative Redeemable Preferred Stock,,,NASDAQ
LANDP,Gladstone Land Corporation 6.00% Series C Cumulative Redeemable Preferred Stock,,,NASDAQ
LANV,Lanvin Group Holdings Limited Ordinary Shares,,,NYSE
LAR,Lithium Argentina AG Common Shares,,,NYSE
LARK,Landmark Bancorp Inc. Common Stock,,,NASDAQ
LASE,Laser Photonics Corporation Common Stock,,,NASDAQ
LASR,"nLIGHT, Inc. Common Stock",,,NASDAQ
LATA,Galata Acquisition Corp. II Class A Ordinary Shares,,,NASDAQ
LATAU,Galata Acquisition Corp. II Units,,,NASDAQ
LAUR,"Laureate Education, Inc. Common Stock",,,NASDAQ
LAW,"CS Disco, Inc. Common Stock",,,NYSE
LAZ,"Lazard, Inc. Common Stock",,,NYSE
LB,LandBridge Company LLC Class A Shares Representing Limited Liability Company Interests,,,NYSE
LBGJ,Li Bang International Corporation Class A Ordinary Shares,,,NASDAQ
LBRDA,Liberty Broadband Corporation Class A Common Stock,,,NASDAQ
LBRDK,Liberty Broadband Corporation Class C Common Stock,,,NASDAQ
LBRDP,Liberty Broadband Corporation Series A Cumulative Redeemable Preferred Stock,,,NASDAQ
LBRT,Liberty Energy Inc. Class A common stock,,,NYSE
LBRX,LB Pharmaceuticals Inc Common Stock,,,NASDAQ
LBTYA,Liberty Global Ltd. Class A Common Shares,,,NASDAQ
LBTYB,Liberty Global Ltd. Class B Common Shares,,,NASDAQ
LBTYK,Liberty Global Ltd. Class C Common Shares,,,NASDAQ
LC,LendingClub Corporation Common Stock,,,NYSE
LCCC,Lakeshore Acquisition III Corp. Ordinary Shares,,,NASDAQ
LCCCU,Lakeshore Acquisition III Corp. Unit,,,NASDAQ
LCFY,Locafy Limited Ordinary Share,,,NASDAQ
LCFYW,Locafy Limited Warrant,,,NASDAQ
LCID,"Lucid Group, Inc. Common Stock",,,NASDAQ
LCII,LCI Industries,,,NYSE
LCLN,"Lincoln International, Inc. Class A Common Stock",,,NYSE
LCNB,LCNB Corporation Common Stock,,,NASDAQ
LCTX,"Lineage Cell Therapeutics, Inc. Common Stock",,,AMEX
LCUT,"Lifetime Brands, Inc. Common Stock",,,NASDAQ
LDI,"loanDepot, Inc. Class A Common Stock",,,NYSE
LDOS,"Leidos Holdings, Inc. Common Stock",,,NYSE
LDP,"Cohen & Steers Limited Duration Preferred and Income Fund, Inc.",,,NYSE
LE,"Lands' End, Inc. Common Stock",,,NASDAQ
LEA,Lear Corporation Common Stock,,,NYSE
LECO,"Lincoln Electric Holdings, Inc. Common Shares",,,NASDAQ
LEDS,SemiLEDS Corporation Common Stock,,,NASDAQ
LEE,"Lee Enterprises, Incorporated Common Stock",,,NASDAQ
LEG,"Leggett & Platt, Incorporated Common Stock",,,NYSE
LEGH,Legacy Housing Corporation Common Stock (TX),,,NASDAQ
LEGN,Legend Biotech Corporation American Depositary Shares,,,NASDAQ
LEGO,Legato Merger Corp. IV Ordinary Shares,,,AMEX
LEN,Lennar Corporation Class A Common Stock,,,NYSE
LENZ,"LENZ Therapeutics, Inc. Common Stock",,,NASDAQ
LEO,"BNY Mellon Strategic Municipals, Inc. Common Stock",,,NYSE
LESL,"Leslie's, Inc. Common Stock",,,NASDAQ
LEU,Centrus Energy Corp. Class A Common Stock,,,NYSE
LEVI,Levi Strauss & Co Class A Common Stock,,,NYSE
LFAC,Leapfrog Acquisition Corporation Class A Ordinary Shares,,,NASDAQ
LFCR,"Lifecore Biomedical, Inc. Common Stock",,,NASDAQ
LFMD,"LifeMD, Inc. Common Stock",,,NASDAQ
LFMDP,"LifeMD, Inc. 8.875% Series A Cumulative Perpetual Preferred Stock",,,NASDAQ
LFS,"LEIFRAS Co., Ltd. American Depositary Shares  ",,,NASDAQ
LFST,"LifeStance Health Group, Inc. Common Stock",,,NASDAQ
LFT,"Lument Finance Trust, Inc. Common Stock",,,NYSE
LFTO,"Liftoff Mobile, Inc. Common Stock",,,NASDAQ
LFUS,"Littelfuse, Inc. Common Stock",,,NASDAQ
LFVN,Lifevantage Corporation Common Stock (Delaware),,,NASDAQ
LFWD,Lifeward Ltd. Ordinary Shares,,,NASDAQ
LGCL,Lucas GC Limited Ordinary Shares,,,NASDAQ
LGCY,Legacy Education Inc. Common Stock,,,AMEX
LGI,Lazard Global Total Return and Income Fund Common Stock,,,NYSE
LGIH,"LGI Homes, Inc. Common Stock",,,NASDAQ
LGL,"LGL Group, Inc. (The) Common Stock",,,AMEX
LGN,Legence Corp. Class A Common stock,,,NASDAQ
LGND,Ligand Pharmaceuticals Incorporated Common Stock,,,NASDAQ
LH,Labcorp Holdings Inc. Common Stock,,,NYSE
LHX,"L3Harris Technologies, Inc. Common Stock",,,NYSE
LI,Li Auto Inc. American Depositary Shares,,,NASDAQ
LICN,Lichen International Limited Class A Ordinary Shares,,,NASDAQ
LIDR,"AEye, Inc. Class A Common Stock",,,NASDAQ
LIEN,"Chicago Atlantic BDC, Inc. Common Stock",,,NASDAQ
LIF,"Life360, Inc. Common Stock",,,NASDAQ
LIFE,Ethos Technologies Inc. Class A Common Stock,,,NASDAQ
LII,"Lennox International, Inc. Common Stock",,,NYSE
LILA,Liberty Latin America Ltd. Class A Common Stock,,,NASDAQ
LILAK,Liberty Latin America Ltd. Class C Common Stock,,,NASDAQ
LILAV,Liberty Latin America Ltd Class A Common Stock Ex-Distribution When Issued,,,NASDAQ
LILKV,Liberty Latin America Ltd Class C Common Stock Ex-Distribution When Issued,,,NASDAQ
LILPV,Liberty Latin America Ltd. 9.0% Fixed Rate Cumulative Perpetual Redeemable Series A Preference Shares,,,NASDAQ
LIN,Linde plc Ordinary Shares,,,NASDAQ
LINC,Lincoln Educational Services Corporation Common Stock,,,NASDAQ
LIND,Lindblad Expeditions Holdings Inc. Common Stock,,,NASDAQ
LINE,"Lineage, Inc. Common Stock",,,NASDAQ
LINK,"Interlink Electronics, Inc. Common Stock",,,NASDAQ
LION,Lionsgate Studios Corp Common Shares,,,NYSE
LITB,"LightInTheBox Holding Co., Ltd. American Depositary Shares, each representing twelve ordinary shares",,,NYSE
LITE,Lumentum Holdings Inc. Common Stock,,,NASDAQ
LIVE,Live Ventures Incorporated Common Stock,,,NASDAQ
LIVN,LivaNova PLC Ordinary Shares,,,NASDAQ
