ticker,name,sector,industry,exchange
RILYL,"BRC Group Holdings, Inc. Depositary Shares each representing 1/1000th in a share of 7.375% Series B Cumulative Perpetual Preferred Stock, par value $0.0001",,,NASDAQ
RILYN,"BRC Group Holdings, Inc. 6.50% Senior Notes Due 2026",,,NASDAQ
RILYP,"BRC Group Holdings, Inc. Depositary Shares, each representing a 1/1000th fractional interest in a share of Series A Cumulative Perpetual Preferred Stock",,,NASDAQ
RILYT,"BRC Group Holdings, Inc. 6.00% Senior Notes Due 2028",,,NASDAQ
RILYZ,"BRC Group Holdings, Inc. 5.25% Senior Notes due 2028",,,NASDAQ
RIO,Rio Tinto Plc Common Stock,,,NYSE
RIOT,"Riot Platforms, Inc. Common Stock ",,,NASDAQ
RITM,Rithm Capital Corp. Common Stock,,,NYSE
RIV,"RiverNorth Opportunities Fund, Inc. Common Stock",,,NYSE
RIVN,"Rivian Automotive, Inc. Class A Common Stock",,,NASDAQ
RJET,Republic Airways Holdings Inc. Common Stock,,,NASDAQ
RJF,"Raymond James Financial, Inc. Common Stock",,,NYSE
RKDA,"Arcadia Biosciences, Inc. Common Stock",,,NASDAQ
RKLB,Rocket Lab Corporation Common Stock,,,NASDAQ
RKT,"Rocket Companies, Inc. Class A Common Stock",,,NYSE
RKTO,Rocket One Inc. Common Stock,,,NASDAQ
RL,Ralph Lauren Corporation Common Stock,,,NYSE
RLAY,"Relay Therapeutics, Inc. Common Stock",,,NASDAQ
RLGT,"Radiant Logistics, Inc. Common Stock",,,AMEX
RLI,RLI Corp. Common Stock (DE),,,NYSE
RLJ,RLJ Lodging Trust Common Shares of Beneficial Interest $0.01 par value,,,NYSE
RLMD,"Relmada Therapeutics, Inc. Common Stock",,,NASDAQ
RLTY,Cohen & Steers Real Estate Opportunities and Income Fund Common Shares of Beneficial Interest,,,NYSE
RLX,"RLX Technology Inc. American Depositary Shares, each representing the right to receive one (1) Class A ordinary share",,,NYSE
RLYB,Rallybio Corporation Common Stock,,,NASDAQ
RM,Regional Management Corp. Common Stock,,,NYSE
RMAX,"RE/MAX Holdings, Inc. Class A Common Stock",,,NYSE
RMBI,"Richmond Mutual Bancorporation, Inc. Common Stock",,,NASDAQ
RMBS,Rambus Inc. Common Stock,,,NASDAQ
RMCF,"Rocky Mountain Chocolate Factory, Inc. Common Stock",,,NASDAQ
RMCO,Royalty Management Holding Corporation Class A Common Stock,,,NASDAQ
RMD,ResMed Inc. Common Stock,,,NYSE
RMI,"RiverNorth Opportunistic Municipal Income Fund, Inc. Common Stock",,,NYSE
RMIX,"Suncrete, Inc. Class A Common Stock",,,NASDAQ
RMM,"RiverNorth Managed Duration Municipal Income Fund, Inc. Common Stock",,,NYSE
RMMZ,"RiverNorth Managed Duration Municipal Income Fund II, Inc. Common Stock",,,NYSE
RMNI,"Rimini Street, Inc. (DE) Common Stock",,,NASDAQ
RMR,The RMR Group Inc. Class A Common Stock,,,NASDAQ
RMT,"Royce Micro-Cap Trust, Inc. Common Stock",,,NYSE
RNA,"Atrium Therapeutics, Inc. Common Stock",,,NASDAQ
RNAC,"Cartesian Therapeutics, Inc. Common Stock",,,NASDAQ
RNAZ,"TransCode Therapeutics, Inc. Common Stock",,,NASDAQ
RNG,"RingCentral, Inc. Class A Common Stock",,,NYSE
RNGR,"Ranger Energy Services, Inc. Class A Common Stock",,,NYSE
RNGT,Range Capital Acquisition Corp II Class A Ordinary Shares,,,NASDAQ
RNGTU,Range Capital Acquisition Corp II Units,,,NASDAQ
RNP,"Cohen & Steers REIT and Preferred and Income Fund, Inc. Common Shares",,,NYSE
RNR,RenaissanceRe Holdings Ltd. Common Stock,,,NYSE
RNST,Renasant Corporation Common Stock,,,NYSE
RNW,ReNew Energy Global plc Class A Ordinary Shares,,,NASDAQ
ROAD,"Construction Partners, Inc. Class A Common Stock",,,NASDAQ
ROC,Rank One Computing Corporation Common stock,,,NASDAQ
ROCK,"Gibraltar Industries, Inc. Common Stock",,,NASDAQ
ROG,Rogers Corporation Common Stock,,,NYSE
ROIV,Roivant Sciences Ltd. Common Shares,,,NASDAQ
ROK,"Rockwell Automation, Inc. Common Stock",,,NYSE
ROKU,"Roku, Inc. Class A Common Stock",,,NASDAQ
ROL,"Rollins, Inc. Common Stock",,,NYSE
ROLR,"High Roller Technologies, Inc. Common Stock",,,AMEX
ROMA,Roma Green Finance Limited Class A Ordinary Shares,,,NASDAQ
ROOT,"Root, Inc. Class A Common Stock",,,NASDAQ
ROP,"Roper Technologies, Inc. Common Stock",,,NASDAQ
ROST,"Ross Stores, Inc. Common Stock",,,NASDAQ
RPAY,Repay Holdings Corporation Class A Common Stock,,,NASDAQ
RPC,"Ridgepost Capital, Inc. Class A Common Stock",,,NYSE
RPD,"Rapid7, Inc. Common Stock",,,NASDAQ
RPGL,Republic Power Group Limited Class A Ordinary Shares,,,NASDAQ
RPID,"Rapid Micro Biosystems, Inc. Class A Common Stock",,,NASDAQ
RPM,RPM International Inc. Common Stock,,,NYSE
RPRX,Royalty Pharma plc Class A Ordinary Shares ,,,NASDAQ
RPT,Rithm Property Trust Inc. Common stock,,,NYSE
RQI,Cohen & Steers Quality Income Realty Fund Inc Common Shares,,,NYSE
RR,Richtech Robotics Inc. Class B Common Stock,,,NASDAQ
RRBI,"Red River Bancshares, Inc. Common Stock",,,NASDAQ
RRC,Range Resources Corporation Common Stock,,,NYSE
RREV,RRE Ventures Acquisition Corp. Class A Ordinary Shares,,,NASDAQ
RREVU,RRE Ventures Acquisition Corp. Units,,,NASDAQ
RRGB,"Red Robin Gourmet Burgers, Inc. Common Stock",,,NASDAQ
RRR,"Red Rock Resorts, Inc. Class A Common Stock",,,NASDAQ
RRX,Regal Rexnord Corporation Common Stock,,,NYSE
RS,"Reliance, Inc. Common Stock",,,NYSE
RSF,RiverNorth Capital and Income Fund Common Stock,,,NYSE
RSG,"Republic Services, Inc. Common Stock",,,NYSE
RSI,"Rush Street Interactive, Inc. Class A Common Stock",,,NYSE
RSKD,Riskified Ltd. Class A Ordinary Shares,,,NYSE
RSSS,"Research Solutions, Inc Common Stock",,,NASDAQ
RSVR,"Reservoir Media, Inc. Common Stock",,,NASDAQ
RTAC,Renatus Tactical Acquisition Corp I Class A Ordinary Shares,,,NASDAQ
RTACU,Renatus Tactical Acquisition Corp I Unit,,,NASDAQ
RTB,"RTB Digital, Inc. Common Stock",,,NASDAQ
RTO,Rentokil Initial plc American Depositary Shares (each representing five (5) Ordinary Shares),,,NYSE
RTX,RTX Corporation Common Stock,,,NYSE
RUM,Rumble Inc. Class A Common Stock,,,NASDAQ
RUMBW,Rumble Inc. Warrant,,,NASDAQ
RUN,Sunrun Inc. Common Stock,,,NASDAQ
RUSHA,"Rush Enterprises, Inc. Common Stock Cl A",,,NASDAQ
RUSHB,"Rush Enterprises, Inc. Class B",,,NASDAQ
RVI,Robinhood Ventures Fund I Common Shares of Beneficial Interest,,,NYSE
RVLV,"Revolve Group, Inc. Class A Common Stock",,,NYSE
RVMD,"Revolution Medicines, Inc. Common Stock",,,NASDAQ
RVMDW,"Revolution Medicines, Inc. Warrant",,,NASDAQ
RVSB,Riverview Bancorp Inc Common Stock,,,NASDAQ
RVSN,Rail Vision Ltd. Ordinary Share,,,NASDAQ
RVT,"Royce Small-Cap Trust, Inc. Common Stock",,,NYSE
RVTY,"Revvity, Inc. Common Stock",,,NYSE
RWAY,Runway Growth Finance Corp. Common Stock,,,NASDAQ
RWAYI,Runway Growth Finance Corp. 7.25% Notes due 2031,,,NASDAQ
RWAYL,Runway Growth Finance Corp. 7.50% Notes due 2027,,,NASDAQ
RWT,"Redwood Trust, Inc. Common Stock",,,NYSE
RWTN,"Redwood Trust, Inc. 9.125% Senior Notes Due 2029",,,NYSE
RWTO,"Redwood Trust, Inc. 9.00% Senior Notes Due 2029",,,NYSE
RWTP,"Redwood Trust, Inc. 9.125% Senior Notes Due 2030",,,NYSE
RWTQ,"Redwood Trust, Inc. 9.500% Senior Notes Due 2030",,,NYSE
RWTS,"Redwood Trust, Inc. 9.75% Senior Notes Due 2031",,,NYSE
RXO,"RXO, Inc. Common Stock",,,NYSE
RXRX,"Recursion Pharmaceuticals, Inc. Class A Common Stock",,,NASDAQ
RXST,"RxSight, Inc. Common Stock",,,NASDAQ
RXT,"Rackspace Technology, Inc. Common Stock",,,NASDAQ
RY,Royal Bank Of Canada Common Stock,,,NYSE
RYAAY,Ryanair Holdings plc American Depositary Shares,,,NASDAQ
RYAM,Rayonier Advanced Materials Inc. Common Stock,,,NYSE
RYAN,"Ryan Specialty Holdings, Inc. Class A Common Stock",,,NYSE
RYM,"RYTHM, Inc. Common Stock",,,NASDAQ
RYN,Rayonier Inc. REIT Common Stock,,,NYSE
RYOJ,"rYojbaba Co., Ltd. Common Shares",,,NASDAQ
RYTM,"Rhythm Pharmaceuticals, Inc. Common Stock",,,NASDAQ
RYZ,Ryerson Holding Corporation Common Stock,,,NYSE
RZB,"Reinsurance Group of America, Incorporated 5.75% Fixed-To-Floating Rate Subordinated Debentures due 2056",,,NYSE
RZC,"Reinsurance Group of America, Incorporated 7.125% Fixed-Rate Reset Subordinated Debentures due 2052",,,NYSE
RZLT,"Rezolute, Inc. Common Stock (NV)",,,NASDAQ
RZLV,Rezolve AI PLC Ordinary Shares,,,NASDAQ
S,"SentinelOne, Inc. Class A Common Stock",,,NYSE
SA,"Seabridge Gold, Inc. Common Shares New",,,NYSE
SAAQ,Space Asset Acquisition Corp. Class A Ordinary Shares,,,NASDAQ
SAAQU,Space Asset Acquisition Corp. Units,,,NASDAQ
SABA,Saba Capital Income & Opportunities Fund II Shares of Beneficial Interest,,,NYSE
SABR,Sabre Corporation Common Stock,,,NASDAQ
SABS,"SAB Biotherapeutics, Inc. Common Stock",,,NASDAQ
SAC,Safeguard Acquisition Corp. Class A Ordinary Shares,,,NYSE
SACH,Sachem Capital Corp. Common Shares,,,AMEX
SAFE,Safehold Inc. New Common Stock ,,,NYSE
SAFT,"Safety Insurance Group, Inc. Common Stock",,,NASDAQ
SAGU,Shreya Acquisition Group Class A Ordinary Shares,,,NYSE
SAH,"Sonic Automotive, Inc. Common Stock",,,NYSE
SAIA,"Saia, Inc. Common Stock",,,NASDAQ
SAIC,Science Applications International Corporation Common Stock,,,NASDAQ
SAIH,SAIHEAT Limited Class A Ordinary Shares,,,NASDAQ
SAIL,"SailPoint, Inc. Common Stock",,,NASDAQ
SAJ,Saratoga Investment Corp 8.00% Notes due 2027,,,NYSE
SAM,"Boston Beer Company, Inc. (The) Common Stock",,,NYSE
SAMG,Silvercrest Asset Management Group Inc. Class A Common Stock,,,NASDAQ
SAN,"Banco Santander, S.A. Sponsored ADR (Spain)",,,NYSE
SANA,"Sana Biotechnology, Inc. Common Stock",,,NASDAQ
SANG,Sangoma Technologies Corporation Common Shares,,,NASDAQ
SANM,Sanmina Corporation Common Stock,,,NASDAQ
SAP,SAP  SE ADS,,,NYSE
SAR,Saratoga Investment Corp New,,,NYSE
SARO,"StandardAero, Inc. Common Stock",,,NYSE
SAT,Saratoga Investment Corp 6.00% Notes due 2027,,,NYSE
SATA,"Strive, Inc. Variable Rate Series A Perpetual Preferred Stock",,,NASDAQ
SATL,Satellogic Inc. Class A Common Stock,,,NASDAQ
SATLW,Satellogic Inc. Warrant,,,NASDAQ
SATS,EchoStar  Corporation Common Stock,,,NASDAQ
SAV,Saratoga Investment Corp 7.50% Notes due 2031,,,NYSE
SAY,Saratoga Investment Corp 8.125% Notes due 2027,,,NYSE
SAZ,Saratoga Investment Corp 8.50% Notes due 2028,,,NYSE
SB,"Safe Bulkers, Inc Common Stock ($0.001 par value)",,,NYSE
SBAC,SBA Communications Corporation Class A Common Stock,,,NASDAQ
SBC,SBC Medical Group Holdings Incorporated Common Stock,,,NASDAQ
SBCF,Seacoast Banking Corporation of Florida Common Stock,,,NASDAQ
SBET,"Sharplink, Inc. Common Stock",,,NASDAQ
SBFG,"SB Financial Group, Inc. Common Stock",,,NASDAQ
SBFM,Sunshine Biopharma Inc. Common Stock,,,NASDAQ
SBGI,"Sinclair, Inc. Class A Common Stock",,,NASDAQ
SBH,"Sally Beauty Holdings, Inc. (Name to be changed from Sally Holdings, Inc.) Common Stock",,,NYSE
SBI,Western Asset Intermediate Muni Fund Inc Common Stock,,,NYSE
SBLK,Star Bulk Carriers Corp. Common Shares,,,NASDAQ
SBMT,Silver Bow Mining Corp. Common Shares,,,AMEX
SBR,Sabine Royalty Trust Common Stock,,,NYSE
SBRA,"Sabra Health Care REIT, Inc. Common Stock",,,NASDAQ
SBS,Companhia de saneamento Basico Do Estado De Sao Paulo - Sabesp American Depositary Shares (Each repstg 250 Common Shares),,,NYSE
SBSI,"Southside Bancshares, Inc. Common Stock",,,NYSE
SBSW,D/B/A Sibanye-Stillwater Limited ADS,,,NYSE
SBUX,Starbucks Corporation Common Stock,,,NASDAQ
SBXD,SilverBox Corp IV Class A Ordinary Shares,,,NYSE
SBXE,SilverBox Corp V Class A Ordinary Shares,,,NYSE
SCCD,Sachem Capital Corp. 6.00% Notes due 2026,,,AMEX
SCCE,Sachem Capital Corp. 6.00% Notes due 2027,,,AMEX
SCCF,Sachem Capital Corp. 7.125% Notes due 2027,,,AMEX
SCCG,Sachem Capital Corp. 8.00% Notes due 2027,,,AMEX
SCCO,Southern Copper Corporation Common Stock,,,NYSE
SCD,LMP Capital and Income Fund Inc. Common Stock,,,NYSE
SCHL,Scholastic Corporation Common Stock,,,NASDAQ
SCHW,Charles Schwab Corporation (The) Common Stock,,,NYSE
SCI,Service Corporation International Common Stock,,,NYSE
SCII,SC II Acquisition Corp. Class A ordinary share,,,NASDAQ
SCIIU,SC II Acquisition Corp. Units,,,NASDAQ
SCL,Stepan Company Common Stock,,,NYSE
SCLX,Scilex Holding Company Common Stock,,,NASDAQ
SCM,Stellus Capital Investment Corporation Common Stock,,,NYSE
SCOR,"comScore, Inc. Common Stock",,,NASDAQ
SCPQ,Social Commerce Partners Corporation Class A Ordinary Shares,,,NASDAQ
SCPQU,Social Commerce Partners Corporation Unit,,,NASDAQ
SCSC,"ScanSource, Inc. Common Stock",,,NASDAQ
SCWO,374Water Inc. Common Stock,,,NASDAQ
SCYX,"SCYNEXIS, Inc. Common Stock",,,NASDAQ
SCZM,Santacruz Silver Mining Ltd. Common Shares,,,NASDAQ
SD,"SandRidge Energy, Inc. Common Stock",,,NYSE
SDEV,Stablecoin Development Corporation Common Stock,,,AMEX
SDGR,"Schrodinger, Inc. Common Stock",,,NASDAQ
SDHC,Smith Douglas Homes Corp. Class A Common Stock,,,NYSE
SDHI,Siddhi Acquisition Corp Class A Common stock,,,NASDAQ
SDHY,PGIM Short Duration High Yield Opportunities Fund Common Shares,,,NYSE
SDOT,Sadot Group Inc. Common Stock,,,NASDAQ
SDRL,Seadrill Limited Common Shares,,,NYSE
SDST,Stardust Power Inc. Common Stock,,,NASDAQ
SE,"Sea Limited American Depositary Shares, each representing one Class A Ordinary Share",,,NYSE
SEAT,Vivid Seats Inc. Class A Common Stock,,,NASDAQ
SEDG,"SolarEdge Technologies, Inc. Common Stock",,,NASDAQ
SEED,Origin Agritech Limited Common Stock,,,NASDAQ
SEER,"Seer, Inc. Class A Common Stock",,,NASDAQ
SEG,Seaport Entertainment Group Inc. Common Stock,,,NYSE
SEGG,Sports Entertainment Gaming Global Corporation Common Stock,,,NASDAQ
SEI,"Solaris Energy Infrastructure, Inc. Class A Common Stock",,,NYSE
SEIC,SEI Investments Company Common Stock,,,NASDAQ
SELF,"Global Self Storage, Inc. Common Stock",,,NASDAQ
SEM,Select Medical Holdings Corporation Common Stock,,,NYSE
SENEA,Seneca Foods Corp. Class A Common Stock,,,NASDAQ
SENEB,Seneca Foods Corp. Class B Common Stock,,,NASDAQ
SENS,"Senseonics Holdings, Inc. Common Stock",,,NASDAQ
SEPN,"Septerna, Inc. Common Stock",,,NASDAQ
SER,"Serina Therapeutics, Inc. Common Stock",,,AMEX
SERA,"Sera Prognostics, Inc. Class A Common Stock",,,NASDAQ
SERV,Serve Robotics Inc. Common Stock,,,NASDAQ
SES,SES AI Corporation Class A Common Stock,,,NYSE
SEV,Aptera Motors Corp. Class B Common Stock,,,NASDAQ
SEVN,Seven Hills Realty Trust Common Stock,,,NASDAQ
SEZL,Sezzle Inc. Common Stock,,,NASDAQ
SF,Stifel Financial Corporation Common Stock,,,NYSE
SFB,Stifel Financial Corporation 5.20% Senior Notes due 2047,,,NYSE
SFBC,"Sound Financial Bancorp, Inc. Common Stock",,,NASDAQ
SFBS,"ServisFirst Bancshares, Inc. Common Stock",,,NYSE
SFD,"Smithfield Foods, Inc. Common Stock",,,NASDAQ
SFHG,Samfine Creation Holdings Group Limited Class A Ordinary Share,,,NASDAQ
SFIX,"Stitch Fix, Inc. Class A Common Stock",,,NASDAQ
SFL,SFL Corporation Ltd,,,NYSE
SFM,"Sprouts Farmers Market, Inc. Common Stock",,,NASDAQ
SFNC,Simmons First National Corporation Class A Common Stock,,,NASDAQ
SFST,"Southern First Bancshares, Inc. Common Stock",,,NASDAQ
SG,"Sweetgreen, Inc. Class A Common Stock",,,NYSE
SGA,"Saga Communications, Inc. Class A Common Stock (FL)",,,NASDAQ
SGC,"Superior Group of Companies, Inc. Common Stock",,,NASDAQ
SGHC,Super Group (SGHC) Limited Ordinary Shares,,,NYSE
SGHT,"Sight Sciences, Inc. Common Stock",,,NASDAQ
SGI,Somnigroup International Inc. Common Stock,,,NYSE
SGML,Sigma Lithium Corporation Common Shares,,,NASDAQ
SGMT,Sagimet Biosciences Inc. Series A Common Stock,,,NASDAQ
SGP,"SpyGlass Pharma, Inc. Common Stock",,,NASDAQ
SGRY,"Surgery Partners, Inc. Common Stock",,,NASDAQ
SGU,Star Group L.P. Common Stock,,,NYSE
SHAK,"Shake Shack, Inc. Class A Common Stock",,,NYSE
SHAZ,"SharonAI Holdings, Inc. Class A Common Stock",,,NASDAQ
SHBI,Shore Bancshares Inc Common Stock,,,NASDAQ
SHC,Sotera Health Company Common Stock,,,NASDAQ
SHEL,Shell PLC American Depositary Shares (each representing two (2) Ordinary Shares) ,,,NYSE
SHEN,Shenandoah Telecommunications Co Common Stock,,,NASDAQ
SHG,Shinhan Financial Group Co Ltd American Depositary Shares,,,NYSE
SHIM,Shimmick Corporation Common Stock,,,NASDAQ
SHIP,Seanergy Maritime Holdings Corp. Common Stock,,,NASDAQ
SHLS,"Shoals Technologies Group, Inc. Class A Common Stock",,,NASDAQ
SHMD,SCHMID Group N.V. Class A Ordinary Shares,,,NASDAQ
SHMDW,SCHMID Group N.V. Warrants,,,NASDAQ
SHO,"Sunstone Hotel Investors, Inc. Sunstone Hotel Investors, Inc. Common Shares",,,NYSE
SHOE,"Shoe Station Group, Inc. Common Stock",,,NASDAQ
SHOO,"Steven Madden, Ltd. Common Stock",,,NASDAQ
SHOP,Shopify Inc. Class A Subordinate Voting Shares,,,NASDAQ
SHOTU,RMG ML Sports Holdings Unit,,,NASDAQ
SHPH,"Shuttle Pharmaceuticals Holdings, Inc. Common Stock",,,NASDAQ
SHW,Sherwin-Williams Company (The) Common Stock,,,NYSE
SI,"Shoulder Innovations, Inc. Common Stock",,,NYSE
SIBN,"SI-BONE, Inc. Common Stock",,,NASDAQ
SID,Companhia Siderurgica Nacional S.A. Common Stock,,,NYSE
SIDU,"Sidus Space, Inc. Class A Common Stock",,,NASDAQ
SIEB,Siebert Financial Corp. Common Stock,,,NASDAQ
SIF,"SIFCO Industries, Inc. Common Stock",,,AMEX
SIFY,Sify Technologies Limited American Depositary Shares,,,NASDAQ
SIG,Signet Jewelers Limited Common Shares,,,NYSE
SIGA,SIGA Technologies Inc. Common Stock,,,NASDAQ
SIGI,"Selective Insurance Group, Inc. Common Stock",,,NASDAQ
SIGIP,"Selective Insurance Group, Inc. Depositary Shares, each representing a 1/1,000th interest in a share of 4.60% Non-Cumulative Preferred Stock, Series B",,,NASDAQ
SII,Sprott Inc. Common Shares,,,NYSE
SILA,"Sila Realty Trust, Inc. Common Stock",,,NYSE
SILC,Silicom Ltd Ordinary Shares,,,NASDAQ
SILO,"Silo Pharma, Inc. Common Stock",,,NASDAQ
SIM,"Grupo Simec, S.A.B. de C.V. American Depositary Shares",,,AMEX
SIMA,SIM Acquisition Corp. I Class A Ordinary Shares,,,NASDAQ
SIMAU,SIM Acquisition Corp. I Unit,,,NASDAQ
SIMO,Silicon Motion Technology Corporation American Depositary Shares,,,NASDAQ
SINT,"SiNtx Technologies, Inc. Common Stock",,,NASDAQ
SION,"Sionna Therapeutics, Inc. Common Stock",,,NASDAQ
SIRI,SiriusXM Holdings Inc. Common Stock,,,NASDAQ
SITC,SITE Centers Corp. Common Stock,,,NYSE
SITE,"SiteOne Landscape Supply, Inc. Common Stock",,,NYSE
SITM,SiTime Corporation Common Stock,,,NASDAQ
SJM,The J.M. Smucker Company Common Stock,,,NYSE
SJT,San Juan Basin Royalty Trust Common Stock,,,NYSE
SKBL,Skyline Builders Group Holding Limited Class A Ordinary Shares,,,NASDAQ
SKE,Skeena Resources Limited Common Shares,,,NYSE
SKIL,Skillsoft Corp. Class A Common Stock,,,NYSE
SKK,SKK Holdings Limited Class A Ordinary Shares,,,NASDAQ
SKLZ,Skillz Inc. Class A Common Stock,,,NYSE
SKM,"SK Telecom Co., Ltd. Common Stock",,,NYSE
SKT,Tanger Inc. Common Stock,,,NYSE
SKWD,"Skyward Specialty Insurance Group, Inc. Common Stock",,,NASDAQ
SKY,"Champion Homes, Inc. Common Stock",,,NYSE
SKYA,"SkyAI, Inc. Common Stock",,,NASDAQ
SKYH,Sky Harbour Group Corporation Class A Common Stock,,,NYSE
SKYQ,Sky Quarry Inc. Common Stock,,,NASDAQ
SKYT,"SkyWater Technology, Inc. Common Stock",,,NASDAQ
SKYW,"SkyWest, Inc. Common Stock",,,NASDAQ
SKYX,SKYX Platforms Corp. Common Stock,,,NASDAQ
SLAB,"Silicon Laboratories, Inc. Common Stock",,,NASDAQ
SLB,SLB Limited Common Shares,,,NYSE
SLDB,Solid Biosciences Inc. Common Stock,,,NASDAQ
SLDE,"Slide Insurance Holdings, Inc. Common Stock",,,NASDAQ
SLDP,"Solid Power, Inc. Class A Common Stock",,,NASDAQ
SLE,"Super League Enterprise, Inc. Common Stock",,,NASDAQ
SLF,Sun Life Financial Inc. Common Stock,,,NYSE
SLG,SL Green Realty Corp Common Stock,,,NYSE
SLGL,Sol-Gel Technologies Ltd. Ordinary Shares,,,NASDAQ
SLGN,Silgan Holdings Inc. Common Stock,,,NYSE
SLI,Standard Lithium Ltd. Common Shares,,,AMEX
SLM,SLM Corporation Common Stock,,,NASDAQ
SLMBP,"SLM Corporation Floating Rate Non-Cumulative Preferred Stock, Series B",,,NASDAQ
SLMT,Brera Holdings PLC Class B Ordinary Shares,,,NASDAQ
SLN,Silence Therapeutics Plc American Depository Share,,,NASDAQ
SLND,"Southland Holdings, Inc. Common Stock",,,AMEX
SLNG,"Stabilis Solutions, Inc. Common Stock",,,NASDAQ
SLNH,"Soluna Holdings, Inc. Common Stock",,,NASDAQ
SLNHP,"Soluna Holdings, Inc 9.0% Series A Cumulative Perpetual Preferred Stock ",,,NASDAQ
SLP,"Simulations Plus, Inc. Common Stock",,,NASDAQ
SLRC,SLR Investment Corp. Common Stock,,,NASDAQ
SLS,"SELLAS Life Sciences Group, Inc. Common Stock",,,NASDAQ
SLSN,"Solesence, Inc. Common Stock",,,NASDAQ
SLSR,Solaris Resources Inc. Common Shares,,,AMEX
SLVM,Sylvamo Corporation Common Stock,,,NYSE
SLXN,Silexion Therapeutics Corp Ordinary Shares,,,NASDAQ
SM,SM Energy Company Common Stock,,,NYSE
SMA,"SmartStop Self Storage REIT, Inc. Common Stock",,,NYSE
SMBC,"Southern Missouri Bancorp, Inc. Common Stock",,,NASDAQ
SMBK,"SmartFinancial, Inc. Common Stock",,,NYSE
SMC,Summit Midstream Corporation Common Stock,,,NYSE
SMCI,"Super Micro Computer, Inc. Common Stock",,,NASDAQ
SMFG,Sumitomo Mitsui Financial Group Inc Unsponsored American Depositary Shares (Japan),,,NYSE
SMG,Scotts Miracle-Gro Company (The) Common Stock,,,NYSE
SMHI,SEACOR Marine Holdings Inc. Common Stock ,,,NYSE
SMID,Smith-Midland Corporation Common Stock,,,NASDAQ
SMJF,SMJ International Holdings Inc. Class A Ordinary Shares,,,AMEX
SMMT,Summit Therapeutics Inc. Common Stock ,,,NASDAQ
SMP,"Standard Motor Products, Inc. Common Stock",,,NYSE
SMPL,The Simply Good Foods Company Common Stock,,,NASDAQ
SMR,NuScale Power Corporation Class A Common Stock,,,NYSE
SMRT,"SmartRent, Inc. Class A Common Stock",,,NYSE
SMSI,"Smith Micro Software, Inc. Common Stock",,,NASDAQ
SMTC,Semtech Corporation Common Stock,,,NASDAQ
SMTI,Sanara MedTech Inc. Common Stock,,,NASDAQ
SMWB,Similarweb Ltd. Ordinary Shares,,,NYSE
SMX,SMX (Security Matters) Public Limited Company Ordinary Shares,,,NASDAQ
SN,"SharkNinja, Inc. Ordinary Shares",,,NYSE
SNA,Snap-On Incorporated Common Stock,,,NYSE
SNAP,Snap Inc. Class A Common Stock,,,NYSE
SND,"Smart Sand, Inc. Common Stock",,,NASDAQ
SNDA,"Sonida Senior Living, Inc. Common Stock",,,NYSE
SNDL,SNDL Inc. Common Shares,,,NASDAQ
SNDR,"Schneider National, Inc. Common Stock",,,NYSE
SNDX,"Syndax Pharmaceuticals, Inc. Common Stock",,,NASDAQ
SNES,"SenesTech, Inc. Common Stock",,,NASDAQ
SNEX,StoneX Group Inc. Common Stock,,,NASDAQ
SNFCA,Security National Financial Corporation Class A Common Stock,,,NASDAQ
SNN,"Smith & Nephew SNATS, Inc. Common Stock",,,NYSE
SNOA,"Sonoma Pharmaceuticals, Inc. Common Stock",,,NASDAQ
SNOW,Snowflake Inc. Common Stock,,,NYSE
SNPS,"Synopsys, Inc. Common Stock",,,NASDAQ
SNSE,"Sensei Biotherapeutics, Inc. Common Stock",,,NASDAQ
SNT,Senstar Technologies Corporation Common Shares,,,NASDAQ
SNTG,Sentage Holdings Inc. Class A Ordinary Shares,,,NASDAQ
SNWV,"SANUWAVE Health, Inc. Common Stock",,,NASDAQ
SNX,TD SYNNEX Corporation Common Stock,,,NYSE
SNY,Sanofi ADS,,,NASDAQ
SO,Southern Company (The) Common Stock,,,NYSE
SOBO,South Bow Corporation Common Shares,,,NYSE
SOC,Sable Offshore Corp. Common Stock,,,NYSE
SOCA,Solarius Capital Acquisition Corp. Class A Ordinary Share,,,NASDAQ
SOCAU,Solarius Capital Acquisition Corp. Units,,,NASDAQ
SOFI,"SoFi Technologies, Inc. Common Stock  ",,,NASDAQ
SOGP,Sound Group Inc. American Depositary Shares,,,NASDAQ
SOHU,Sohu.com Limited American Depositary Shares,,,NASDAQ
SOJC,"Southern Company (The) Series 2017B 5.25% Junior Subordinated Notes due December 1, 2077",,,NYSE
SOJD,"Southern Company (The) Series 2020A 4.95% Junior Subordinated Notes due January 30, 2080",,,NYSE
SOJE,"Southern Company (The) Series 2020C 4.20% Junior Subordinated Notes due October 15, 2060",,,NYSE
SOJF,"Southern Company (The) Series 2025A 6.50% Junior Subordinated Notes due March 15, 2085",,,NYSE
SOLS,Solstice Advanced Materials Inc. Common Stock ,,,NASDAQ
SOLV,Solventum Corporation Common Stock,,,NYSE
SOMN,Southern Company (The) 2025 Series A Corporate Units,,,NYSE
SON,Sonoco Products Company Common Stock,,,NYSE
SONM,"DNA X, Inc. Common Stock",,,NASDAQ
SONO,"Sonos, Inc. Common Stock",,,NASDAQ
SONY,Sony Group Corporation American Depositary Shares ,,,NYSE
SOPH,SOPHiA GENETICS SA Ordinary Shares,,,NASDAQ
SOR,"Source Capital, Inc. Cmn Shs of BI",,,NYSE
SORA,AsiaStrategy Ordinary Shares,,,NASDAQ
SORN,Soren Acquisition Corp. Class A Ordinary Shares,,,NASDAQ
SORNU,Soren Acquisition Corp. Unit,,,NASDAQ
SOTK,Sono-Tek Corporation Common Stock,,,NASDAQ
SOUL,Soulpower Acquisition Corporation Class A Ordinary Shares,,,NYSE
SOUN,"SoundHound AI, Inc Class A Common Stock",,,NASDAQ
SOUNW,"SoundHound AI, Inc. Warrant",,,NASDAQ
SOWG,Sow Good Inc. Common Stock,,,NASDAQ
SPAI,Safe Pro Group Inc. Common Stock,,,NASDAQ
SPB,"Spectrum Brands Holdings, Inc. Common Stock",,,NYSE
SPCB,"SuperCom, Ltd. Ordinary Shares (Israel)",,,NASDAQ
SPCE,"Virgin Galactic Holdings, Inc. Common Stock",,,NYSE
SPCX,Space Exploration Technologies Corp. Class A Common Stock,,,NASDAQ
SPE,"Special Opportunities Fund, Inc Common Stock",,,NYSE
SPEG,Silver Pegasus Acquisition Corp Class A Ordinary Shares,,,NASDAQ
SPEGU,Silver Pegasus Acquisition Corp Unit,,,NASDAQ
SPFI,"South Plains Financial, Inc. Common Stock",,,NASDAQ
SPG,"Simon Property Group, Inc. Common Stock",,,NYSE
SPGI,S&P Global Inc. Common Stock,,,NYSE
SPH,"Suburban Propane Partners, L.P. Common Stock",,,NYSE
SPHL,Springview Holdings Ltd Class A Ordinary Shares,,,NASDAQ
SPHR,Sphere Entertainment Co. Class A Common Stock,,,NYSE
SPIR,"Spire Global, Inc. Class A Common Stock",,,NYSE
SPKL,Spark I Acquisition Corp. Class A Ordinary Share,,,NASDAQ
SPKLU,Spark I Acquisition Corp. Unit,,,NASDAQ
SPKLW,Spark I Acquisition Corp. Warrant,,,NASDAQ
SPMA,"Sound Point Meridian Capital, Inc. 8.00% Series A Preferred Shares Due 2029",,,NYSE
SPMC,"Sound Point Meridian Capital, Inc. Common Stock",,,NYSE
SPME,"Sound Point Meridian Capital, Inc. 7.875% Series B Preferred Shares due 2030",,,NYSE
SPNT,SiriusPoint Ltd. Common Shares,,,NYSE
SPOK,"Spok Holdings, Inc. Common Stock",,,NASDAQ
SPOT,Spotify Technology S.A. Ordinary Shares,,,NYSE
SPPL,SIMPPLE LTD. Ordinary Shares,,,NASDAQ
SPRB,"Spruce Biosciences, Inc. Common Stock",,,NASDAQ
SPRC,SciSparc Ltd. Ordinary Shares,,,NASDAQ
SPRO,"Spero Therapeutics, Inc. Common Stock",,,NASDAQ
SPRU,Spruce Power Holding Corporation Class A Common Stock,,,NYSE
SPRY,"ARS Pharmaceuticals, Inc. Common Stock",,,NASDAQ
SPSC,"SPS Commerce, Inc. Common Stock",,,NASDAQ
SPT,"Sprout Social, Inc Class A Common Stock",,,NASDAQ
SPTX,"Seaport Therapeutics, Inc. Common Stock",,,NASDAQ
SPWH,"Sportsman's Warehouse Holdings, Inc. Common Stock",,,NASDAQ
SPXC,"SPX Technologies, Inc. Common Stock",,,NYSE
SPXX,Nuveen S&P 500 Dynamic Overwrite Fund,,,NYSE
SQFT,"Presidio Property Trust, Inc. Class A Common Stock",,,NASDAQ
